{
  "schema": 2,
  "run_id": "run-20260101-000000-example",
  "seq": 7,
  "ts": "2026-01-01T00:00:00.000Z",
  "prev": "0123456789abcdef0123456789abcdef0123456789abcdef0123456789abcdef",
  "phase": "build",
  "type": "bundle-store-unavailable",
  "data": {
    "boundary_kind": "issue-merge-floor",
    "boundary_key": "FAFF-1",
    "detail": "remote unreachable"
  }
}
